{
  "$schema": "https://raw.githubusercontent.com/wsl-images/wslb/main/schemas/wslb-workspace.schema.json",
  "name": "WSLB Ubuntu Superset",
  "image": "ubuntu:24.04",
  "features": {
    "ghcr.io/devcontainers/features/common-utils:2": {
      "username": "dev",
      "installZsh": "true",
      "upgradePackages": "false"
    },
    "ghcr.io/devcontainers/features/git:1": {},
    "ghcr.io/devcontainers/features/github-cli:1": {},
    "ghcr.io/devcontainers/features/node:1": {
      "version": "22"
    },
    "ghcr.io/devcontainers/features/python:1": {
      "version": "3.12"
    },
    "ghcr.io/devcontainers/features/go:1": {
      "version": "1.24"
    }
  },
  "remoteUser": "dev",
  "wslb": {
    "version": 1,
    "distroName": "UbuntuDevcontainer",
    "managed": true,
    "state": {
      "mode": "windows-dir"
    },
    "wslconf": {
      "boot": {
        "systemd": true,
        "command": "echo 'boot ok'"
      }
    },
    "distribution": {
      "oobe": {
        "defaultName": "dev",
        "command": "echo 'WSLB OOBE complete'"
      },
      "shortcut": {
        "enabled": true,
        "icon": {
          "simpleIcon": "ubuntu",
          "color": "E95420",
          "style": "flat"
        }
      }
    }
  }
}


