{
  "$schema": "https://raw.githubusercontent.com/wsl-images/wslb/main/schemas/wslb-workspace.schema.json",
  "name": "WSLB Ubuntu Pro",
  "image": "ubuntu:24.04",
  "features": {
    "wslb:feature/wsl-prereqs": {},
    "ghcr.io/devcontainers/features/common-utils:2": {
      "upgradePackages": "false",
      "installZsh": "true"
    },
    "ghcr.io/devcontainers/features/git:1": {},
    "ghcr.io/devcontainers/features/github-cli:1": {},
    "ghcr.io/devcontainers/features/node:1": {
      "version": "22"
    },
    "ghcr.io/devcontainers/features/python:1": {
      "version": "3.12"
    },
    "ghcr.io/devcontainers/features/go:1": {
      "version": "1.24"
    }
  },
  "remoteUser": "dev",
  "wslb": {
    "distroName": "UbuntuPro",
    "managed": true,
    "oobe": {
      "mode": "predefined",
      "strategy": "hybrid",
      "promptForPassword": true
    },
    "state": {
      "mode": "windows-dir"
    },
    "wslconf": {
      "boot": {
        "systemd": true
      },
      "automount": {
        "enabled": true,
        "mountFsTab": true,
        "options": "metadata"
      },
      "interop": {
        "enabled": true,
        "appendWindowsPath": true
      }
    },
    "distribution": {
      "shortcut": {
        "enabled": true,
        "icon": {
          "simpleIcon": "ubuntu",
          "color": "E95420",
          "style": "flat"
        }
      }
    }
  }
}


